{
  "$schema": "https://json-schema.org/draft/2020-12/schema",
  "$id": "https://github.com/RandomDevelopment/ci-fleet-config-template/fleet.schema.json",
  "title": "ci-fleet organization configuration",
  "type": "object",
  "additionalProperties": false,
  "required": ["schema_version", "organization", "runner_pools", "controllers", "host_groups", "environments", "projects"],
  "properties": {
    "$schema": {"type": "string"},
    "schema_version": {"const": 3},
    "organization": {
      "type": "object",
      "additionalProperties": false,
      "required": ["slug", "registry", "delivery_engine", "workflow_ref_policy"],
      "properties": {
        "slug": {"type": "string", "pattern": "^[a-z0-9][a-z0-9-]{0,38}$"},
        "registry": {"type": "string", "pattern": "^[a-z0-9.-]+/[a-z0-9._/-]+$"},
        "delivery_engine": {"const": "RandomDevelopment/ci-fleet"},
        "workflow_ref_policy": {"const": "immutable-commit"}
      }
    },
    "runner_pools": {
      "type": "object",
      "description": "Logical CI pools. Each runner_group value must be unique across pools; scripts/validate.py enforces this cross-object rule.",
      "minProperties": 1,
      "propertyNames": {"$ref": "#/$defs/slug"},
      "additionalProperties": {"$ref": "#/$defs/runner_pool"}
    },
    "controllers": {
      "type": "object",
      "minProperties": 1,
      "propertyNames": {"$ref": "#/$defs/slug"},
      "additionalProperties": {"$ref": "#/$defs/controller"}
    },
    "managed_images": {
      "type": "object",
      "minProperties": 1,
      "propertyNames": {"type": "string", "pattern": "^(?!0{40}$)[0-9a-f]{40}$"},
      "additionalProperties": {"$ref": "#/$defs/managed_images"}
    },
    "host_groups": {
      "type": "object",
      "minProperties": 1,
      "propertyNames": {"$ref": "#/$defs/slug"},
      "additionalProperties": {"$ref": "#/$defs/host_group"}
    },
    "environments": {
      "type": "object",
      "minProperties": 1,
      "propertyNames": {"$ref": "#/$defs/slug"},
      "additionalProperties": {"$ref": "#/$defs/environment"}
    },
    "projects": {
      "type": "object",
      "minProperties": 1,
      "propertyNames": {"$ref": "#/$defs/slug"},
      "additionalProperties": {"$ref": "#/$defs/project"}
    }
  },
  "$defs": {
    "slug": {"type": "string", "pattern": "^[a-z0-9][a-z0-9-]{0,62}$"},
    "repository": {"type": "string", "pattern": "^[A-Za-z0-9_.-]+/[A-Za-z0-9_.-]+$"},
    "image_digest": {"type": "string", "pattern": "^sha256:(?!0{64}$)[0-9a-f]{64}$"},
    "managed_images": {
      "type": "object",
      "additionalProperties": false,
      "minProperties": 1,
      "properties": {
        "amd64": {"$ref": "#/$defs/managed_image_ids"},
        "arm64": {"$ref": "#/$defs/managed_image_ids"}
      }
    },
    "managed_image_ids": {
      "description": "Role scalars are original config digests when the selected runtime source declares portable_managed_image_ids; older source values remain exact opaque local Docker IDs. Derived runtime IDs and host binding proof never belong in this catalog.",
      "type": "object",
      "additionalProperties": false,
      "required": ["controller", "runner"],
      "properties": {
        "controller": {"$ref": "#/$defs/image_digest"},
        "runner": {"$ref": "#/$defs/image_digest"}
      }
    },
    "runner_pool": {
      "type": "object",
      "additionalProperties": false,
      "required": ["runner_group", "routing_labels", "allowed_repositories", "public_repositories", "capacity_budget", "job_submission_policy"],
      "properties": {
        "runner_group": {"$ref": "#/$defs/slug"},
        "routing_labels": {"type": "array", "minItems": 1, "uniqueItems": true, "items": {"$ref": "#/$defs/slug"}},
        "allowed_repositories": {"type": "array", "minItems": 1, "uniqueItems": true, "items": {"$ref": "#/$defs/repository"}},
        "public_repositories": {"const": false},
        "capacity_budget": {"type": "integer", "minimum": 1},
        "job_submission_policy": {"const": "all-independent-jobs"}
      }
    },
    "controller": {
      "type": "object",
      "additionalProperties": false,
      "required": ["pool", "location", "state", "scale_set_name", "lifecycle", "engine_ref", "min_runners", "max_runners", "runner_resources"],
      "properties": {
        "pool": {"$ref": "#/$defs/slug"},
        "location": {"$ref": "#/$defs/slug"},
        "state": {"enum": ["active", "drained", "disabled"]},
        "scale_set_name": {"$ref": "#/$defs/slug"},
        "lifecycle": {"enum": ["experimental", "stable", "retiring"]},
        "engine_ref": {"type": "string", "pattern": "^(?!0{40}$)[0-9a-f]{40}$"},
        "min_runners": {"const": 0},
        "max_runners": {"type": "integer", "minimum": 1},
        "runner_resources": {"$ref": "#/$defs/runner_resources"},
        "docker_storage_retention": {
          "type": "object",
          "additionalProperties": false,
          "required": ["exclusive_fleet_daemon"],
          "properties": {"exclusive_fleet_daemon": {"const": true}}
        },
        "docker_network_policy": {
          "type": "object",
          "additionalProperties": false,
          "required": ["default_address_pools", "networks_per_runner", "reserve_subnets"],
          "properties": {
            "default_bridge_cidr": {"type": "string"},
            "networks_per_runner": {"type": "integer", "minimum": 1},
            "reserve_subnets": {"type": "integer", "minimum": 1},
            "default_address_pools": {
              "type": "array",
              "minItems": 1,
              "maxItems": 64,
              "items": {
                "type": "object",
                "additionalProperties": false,
                "required": ["base", "size"],
                "properties": {
                  "base": {"type": "string"},
                  "size": {"type": "integer", "minimum": 0, "maximum": 29}
                }
              }
            }
          }
        },
        "status_reporting": {
          "type": "object",
          "additionalProperties": false,
          "required": ["enabled", "config_file"],
          "properties": {
            "enabled": {"type": "boolean"},
            "config_file": {"const": "/etc/ci-fleet/monitoring.env"}
          }
        }
      }
    },
    "runner_resources": {
      "type": "object",
      "additionalProperties": false,
      "required": ["cpu_cores", "memory_mib"],
      "properties": {
        "cpu_cores": {"type": "integer", "minimum": 1},
        "memory_mib": {"type": "integer", "minimum": 512}
      }
    },
    "host_group": {
      "type": "object",
      "additionalProperties": false,
      "required": ["role", "environment_class"],
      "properties": {
        "role": {"const": "deployment"},
        "environment_class": {"enum": ["development", "staging", "production"]}
      }
    },
    "environment": {
      "type": "object",
      "additionalProperties": false,
      "required": ["host_group", "automatic", "requires_approval", "required_secret_names"],
      "properties": {
        "host_group": {"type": "string"},
        "automatic": {"type": "boolean"},
        "requires_approval": {"type": "boolean"},
        "required_secret_names": {"type": "array", "uniqueItems": true, "items": {"type": "string", "pattern": "^[A-Z][A-Z0-9_]*$"}}
      }
    },
    "project": {
      "type": "object",
      "additionalProperties": false,
      "required": ["repository", "image", "ci_pool", "ci_contract", "deployments"],
      "properties": {
        "repository": {"$ref": "#/$defs/repository"},
        "image": {"type": "string", "pattern": "^[a-z0-9.-]+/[a-z0-9._/-]+$"},
        "ci_pool": {"type": "string"},
        "ci_contract": {
          "type": "object",
          "additionalProperties": false,
          "required": ["runner_entrypoint", "task_plan", "aggregate_entrypoints", "target_wall_clock_minutes", "max_job_minutes", "shard_target_minutes"],
          "properties": {
            "runner_entrypoint": {"const": "./scripts/ci/run.sh"},
            "task_plan": {"const": "./scripts/ci/plan.json"},
            "aggregate_entrypoints": {
              "type": "object",
              "additionalProperties": false,
              "required": ["fast", "full"],
              "properties": {
                "fast": {"const": "./scripts/ci/run.sh fast"},
                "full": {"const": "./scripts/ci/run.sh full"}
              }
            },
            "target_wall_clock_minutes": {"const": 5},
            "max_job_minutes": {"const": 5},
            "shard_target_minutes": {"type": "integer", "minimum": 1, "maximum": 4}
          }
        },
        "deployments": {"type": "array", "minItems": 1, "uniqueItems": true, "items": {"type": "string"}}
      }
    }
  }
}
