{
  "$schema": "./fleet.schema.json",
  "schema_version": 3,
  "organization": {
    "slug": "example-org",
    "registry": "ghcr.io/example-org",
    "delivery_engine": "RandomDevelopment/ci-fleet",
    "workflow_ref_policy": "immutable-commit"
  },
  "runner_pools": {
    "trusted-ci": {
      "runner_group": "example-trusted-ci",
      "routing_labels": [
        "docker-ci"
      ],
      "allowed_repositories": [
        "example-org/example-app"
      ],
      "public_repositories": false,
      "capacity_budget": 1,
      "job_submission_policy": "all-independent-jobs"
    }
  },
  "managed_images": {
    "254b98a10ea200e39f19bbe75ab9a822de2d5966": {
      "amd64": {
        "controller": "sha256:1111111111111111111111111111111111111111111111111111111111111111",
        "runner": "sha256:2222222222222222222222222222222222222222222222222222222222222222"
      }
    }
  },
  "controllers": {
    "example-ci-01": {
      "pool": "trusted-ci",
      "location": "example-site-a",
      "state": "active",
      "scale_set_name": "example-ci-01",
      "lifecycle": "experimental",
      "engine_ref": "254b98a10ea200e39f19bbe75ab9a822de2d5966",
      "min_runners": 0,
      "max_runners": 1,
      "runner_resources": {
        "cpu_cores": 2,
        "memory_mib": 4096
      },
      "docker_network_policy": {
        "networks_per_runner": 1,
        "reserve_subnets": 1,
        "default_address_pools": [
          {
            "base": "198.51.100.0/24",
            "size": 28
          }
        ]
      }
    }
  },
  "host_groups": {
    "development-apps": {
      "role": "deployment",
      "environment_class": "development"
    },
    "production-apps": {
      "role": "deployment",
      "environment_class": "production"
    }
  },
  "environments": {
    "development": {
      "host_group": "development-apps",
      "automatic": true,
      "requires_approval": false,
      "required_secret_names": [
        "DEPLOY_AUTH"
      ]
    },
    "production": {
      "host_group": "production-apps",
      "automatic": false,
      "requires_approval": true,
      "required_secret_names": [
        "DEPLOY_AUTH"
      ]
    }
  },
  "projects": {
    "example-app": {
      "repository": "example-org/example-app",
      "image": "ghcr.io/example-org/example-app",
      "ci_pool": "trusted-ci",
      "ci_contract": {
        "runner_entrypoint": "./scripts/ci/run.sh",
        "task_plan": "./scripts/ci/plan.json",
        "aggregate_entrypoints": {
          "fast": "./scripts/ci/run.sh fast",
          "full": "./scripts/ci/run.sh full"
        },
        "target_wall_clock_minutes": 5,
        "max_job_minutes": 5,
        "shard_target_minutes": 4
      },
      "deployments": [
        "development",
        "production"
      ]
    }
  }
}
