{
  "$schema": "../../fleet.schema.json",
  "schema_version": 3,
  "organization": {
    "slug": "sample-company",
    "registry": "ghcr.io/sample-company",
    "delivery_engine": "RandomDevelopment/ci-fleet",
    "workflow_ref_policy": "immutable-commit"
  },
  "runner_pools": {
    "trusted-ci": {
      "runner_group": "sample-trusted-ci",
      "routing_labels": [
        "docker-ci"
      ],
      "allowed_repositories": [
        "sample-company/api",
        "sample-company/web"
      ],
      "public_repositories": false,
      "capacity_budget": 6,
      "job_submission_policy": "all-independent-jobs"
    }
  },
  "managed_images": {
    "254b98a10ea200e39f19bbe75ab9a822de2d5966": {
      "amd64": {
        "controller": "sha256:1111111111111111111111111111111111111111111111111111111111111111",
        "runner": "sha256:2222222222222222222222222222222222222222222222222222222222222222"
      }
    }
  },
  "controllers": {
    "sample-ci-primary": {
      "pool": "trusted-ci",
      "location": "primary-site",
      "state": "active",
      "scale_set_name": "sample-ci-primary",
      "lifecycle": "stable",
      "engine_ref": "254b98a10ea200e39f19bbe75ab9a822de2d5966",
      "min_runners": 0,
      "max_runners": 4,
      "runner_resources": {
        "cpu_cores": 4,
        "memory_mib": 8192
      },
      "docker_network_policy": {
        "default_address_pools": [{"base": "198.51.100.0/24", "size": 28}],
        "networks_per_runner": 1,
        "reserve_subnets": 1
      }
    },
    "sample-ci-remote": {
      "pool": "trusted-ci",
      "location": "remote-site",
      "state": "active",
      "scale_set_name": "sample-ci-remote",
      "lifecycle": "stable",
      "engine_ref": "254b98a10ea200e39f19bbe75ab9a822de2d5966",
      "min_runners": 0,
      "max_runners": 2,
      "runner_resources": {
        "cpu_cores": 2,
        "memory_mib": 4096
      },
      "docker_network_policy": {
        "default_address_pools": [{"base": "203.0.113.0/24", "size": 28}],
        "networks_per_runner": 1,
        "reserve_subnets": 1
      }
    }
  },
  "host_groups": {
    "development-east": {
      "role": "deployment",
      "environment_class": "development"
    },
    "staging-east": {
      "role": "deployment",
      "environment_class": "staging"
    },
    "production-primary": {
      "role": "deployment",
      "environment_class": "production"
    }
  },
  "environments": {
    "development": {
      "host_group": "development-east",
      "automatic": true,
      "requires_approval": false,
      "required_secret_names": [
        "DEPLOY_AUTH"
      ]
    },
    "staging": {
      "host_group": "staging-east",
      "automatic": false,
      "requires_approval": true,
      "required_secret_names": [
        "DEPLOY_AUTH"
      ]
    },
    "production": {
      "host_group": "production-primary",
      "automatic": false,
      "requires_approval": true,
      "required_secret_names": [
        "DEPLOY_AUTH"
      ]
    }
  },
  "projects": {
    "api": {
      "repository": "sample-company/api",
      "image": "ghcr.io/sample-company/api",
      "ci_pool": "trusted-ci",
      "ci_contract": {
        "runner_entrypoint": "./scripts/ci/run.sh",
        "task_plan": "./scripts/ci/plan.json",
        "aggregate_entrypoints": {
          "fast": "./scripts/ci/run.sh fast",
          "full": "./scripts/ci/run.sh full"
        },
        "target_wall_clock_minutes": 5,
        "max_job_minutes": 5,
        "shard_target_minutes": 4
      },
      "deployments": [
        "development",
        "staging",
        "production"
      ]
    },
    "web": {
      "repository": "sample-company/web",
      "image": "ghcr.io/sample-company/web",
      "ci_pool": "trusted-ci",
      "ci_contract": {
        "runner_entrypoint": "./scripts/ci/run.sh",
        "task_plan": "./scripts/ci/plan.json",
        "aggregate_entrypoints": {
          "fast": "./scripts/ci/run.sh fast",
          "full": "./scripts/ci/run.sh full"
        },
        "target_wall_clock_minutes": 5,
        "max_job_minutes": 5,
        "shard_target_minutes": 4
      },
      "deployments": [
        "development",
        "production"
      ]
    }
  }
}
